category,title,content,cleaned_title,cleaned_content,label,sentiment
healthcare_en,UN Commission approves WHO recommendations to place psychoactive substances under international control,"<p>Following recommendations by the World Health Organization (WHO), the United Nations Commission on Narcotic Drugs (CND) has decided to place five new psychoactive substances and one medicine under international control. </p><p>The recommendations were developed by WHO Expert Committee on Drug Dependence--ECDD, which consists of global experts analyzing health risks and benefits of psychoactive substances circulating on global markets and alerting to include them under international control if evidence found that their use can cause harm for population health in countries. </p><p>&ldquo;These substances have been brought to WHO&rsquo;s attention for being clandestinely manufactured, posing serious risk to public health and society without any recognized therapeutic use,&rdquo; said Dr Deus Mubangizi, WHO Director for Health Product Policy and Standards. &ldquo;We are pleased that the Commission (on Narcotic Drugs) has accepted the full set of WHO recommendations and added these substances to relevant schedules in the 1961 or 1971 Conventions. We hope countries and communities will increase vigilance and take necessary actions to protect vulnerable groups particularly youth from these substances.&rdquo;</p><p>Four substances placed in Schedule I of the Single Convention on Narcotic Drugs (1961), as amended by the 1972 Protocol are:</p><li><strong>N-Pyrrolidino protonitazene</strong>, also referred to as protonitazepyne, is a synthetic opioid.&nbsp; It has been described as a beige powder or a white colourless or crystalline solid, and has been identified in falsified pharmaceutical opioid tablets. It is reported to be administered by various routes, including smoking, snorting and by injection. It can cause substantial harm, including death. It has no known therapeutic use. </li><li><strong>N-Pyrrolidino metonitazene</strong>, also referred to as metonitazepyne, is a synthetic opioid. It has been described as a beige powder and is reported to be administered by injection. There is evidence that its use causes substantial harm, including death. It has no known therapeutic use.</li><li><strong>Etonitazepipne</strong>, also referred to as N-piperidinyl etonitazene, is a synthetic opioid.&nbsp; It has been described as a crystalline solid and a yellowish-white or yellow powder. There is evidence that use of this substance causes substantial harm, including death. It has no known therapeutic use. </li><li><strong><span style=""text-decoration: underline;""></span></strong><strong>N-Desethyl isotonitazene</strong>,&nbsp;<span style=""text-decoration: underline;""></span>also referred to as norisotonitazene, is a synthetic opioid that has been described as a crystalline solid. It has been identified in falsified pharmaceuticals. Multiple deaths and hospital admissions have been reported in at least two regions. There is evidence that its use causes substantial harm, including death. It has no known therapeutic use. </li><p>Substance placed in Schedule II of the Convention on Psychotropic Substances (1971):</p><li><strong>Hexahydrocannabinol</strong>, also known as HHC, is a semi-synthetic cannabinoid described as a colourless viscous oil or resin. Products such as THC cannabis flowers and resins infused or sprayed with the substance, e-liquids and cartridges for electronic cigarettes, edible products such as gummies and marshmallows, tinctures resembling dietary supplements and distillate oils can include HHC. There is sufficient evidence that HHC is used in ways to constitute a public health and social problem, warranting placement under international control. </li><p>Substance placed in Schedule IV of the Convention on Psychotropic Substances (1971):</p><li><strong>Carisoprodol </strong>is<strong> </strong>a centrally acting skeletal muscle relaxant sold as a single-ingredient preparation and in combination products. Carisoprodol is available as a pharmaceutical product in tablet form, has been detected in falsified pharmaceuticals and is also found as a white powder. There is increasing evidence that nonmedical use of carisoprodol in a number of countries constitutes a significant risk to public health. </li><p>WHO has been convening the ECDD as a scientific advisory body for over 70 years with the mission to protect populations from harmful substances and to ensure that psychoactive substances are available where needed for medical and scientific purposes. The ECDD conducts scientific reviews at the request of the UN Commission on Narcotic Drugs and is the only treaty-mandated body to provide health recommendations to the Commission to inform decisions in drug policy. </p><p>With the ongoing emergence of more harmful substances, including clandestinely manufactured synthetic opioids with no medical use such as fentanyl and nitazenes, Member States expressed interest in more scientific reviews of these substances by WHO in the coming period. Above-mentioned decisions were announced at the 68<sup>th</sup> regular session of the Commission on Narcotic Drugs, taking place in Vienna, Austria, on 10-14 March 2025.&nbsp;</p>",UN Commission approves WHO recommendations to place psychoactive substances under international control,Following recommendations by the World Health Organization WHO the United Nations Commission on Narcotic Drugs CND has decided to place five new psychoactive substances and one medicine under international control The recommendations were developed by WHO Expert Committee on Drug DependenceECDD which consists of global experts analyzing health risks and benefits of psychoactive substances circulating on global markets and alerting to include them under international control if evidence found that their use can cause harm for population health in countries These substances have been brought to WHOs attention for being clandestinely manufactured posing serious risk to public health and society without any recognized therapeutic use said Dr Deus Mubangizi WHO Director for Health Product Policy and Standards We are pleased that the Commission on Narcotic Drugs has accepted the full set of WHO recommendations and added these substances to relevant schedules in the 1961 or 1971 Conventions We hope countries and communities will increase vigilance and take necessary actions to protect vulnerable groups particularly youth from these substancesFour substances placed in Schedule I of the Single Convention on Narcotic Drugs 1961 as amended by the 1972 Protocol areNPyrrolidino protonitazene also referred to as protonitazepyne is a synthetic opioid It has been described as a beige powder or a white colourless or crystalline solid and has been identified in falsified pharmaceutical opioid tablets It is reported to be administered by various routes including smoking snorting and by injection It can cause substantial harm including death It has no known therapeutic use NPyrrolidino metonitazene also referred to as metonitazepyne is a synthetic opioid It has been described as a beige powder and is reported to be administered by injection There is evidence that its use causes substantial harm including death It has no known therapeutic useEtonitazepipne also referred to as Npiperidinyl etonitazene is a synthetic opioid It has been described as a crystalline solid and a yellowishwhite or yellow powder There is evidence that use of this substance causes substantial harm including death It has no known therapeutic use NDesethyl isotonitazene also referred to as norisotonitazene is a synthetic opioid that has been described as a crystalline solid It has been identified in falsified pharmaceuticals Multiple deaths and hospital admissions have been reported in at least two regions There is evidence that its use causes substantial harm including death It has no known therapeutic use Substance placed in Schedule II of the Convention on Psychotropic Substances 1971Hexahydrocannabinol also known as HHC is a semisynthetic cannabinoid described as a colourless viscous oil or resin Products such as THC cannabis flowers and resins infused or sprayed with the substance eliquids and cartridges for electronic cigarettes edible products such as gummies and marshmallows tinctures resembling dietary supplements and distillate oils can include HHC There is sufficient evidence that HHC is used in ways to constitute a public health and social problem warranting placement under international control Substance placed in Schedule IV of the Convention on Psychotropic Substances 1971Carisoprodol is a centrally acting skeletal muscle relaxant sold as a singleingredient preparation and in combination products Carisoprodol is available as a pharmaceutical product in tablet form has been detected in falsified pharmaceuticals and is also found as a white powder There is increasing evidence that nonmedical use of carisoprodol in a number of countries constitutes a significant risk to public health WHO has been convening the ECDD as a scientific advisory body for over 70 years with the mission to protect populations from harmful substances and to ensure that psychoactive substances are available where needed for medical and scientific purposes The ECDD conducts scientific reviews at the request of the UN Commission on Narcotic Drugs and is the only treatymandated body to provide health recommendations to the Commission to inform decisions in drug policy With the ongoing emergence of more harmful substances including clandestinely manufactured synthetic opioids with no medical use such as fentanyl and nitazenes Member States expressed interest in more scientific reviews of these substances by WHO in the coming period Abovementioned decisions were announced at the 68th regular session of the Commission on Narcotic Drugs taking place in Vienna Austria on 1014 March 2025,0,Positive
healthcare_en,"Frank, in-depth discussion as Belgium and WHO map ahead priorities for collaboration","In a three-day strategic dialogue, Belgium and WHO reviewed progress in their longstanding partnership, and agreed to further boost their collaboration on universal health coverage, health-systems strengthening and equitable access to essential vaccines, medicines and health technologies.

The Belgian delegation – headed by H.E. Christophe Payot, Ambassador of Belgium to the United Nations and other international organizations in Geneva – discussed issues of strategic importance, exchanged views on how to smoothly align WHO strategic directions and Belgium's development cooperation priorities in the context of an evolving global health landscape.",Frank indepth discussion as Belgium and WHO map ahead priorities for collaboration,In a threeday strategic dialogue Belgium and WHO reviewed progress in their longstanding partnership and agreed to further boost their collaboration on universal health coverage healthsystems strengthening and equitable access to essential vaccines medicines and health technologies The Belgian delegation headed by HE Christophe Payot Ambassador of Belgium to the United Nations and other international organizations in Geneva discussed issues of strategic importance exchanged views on how to smoothly align WHO strategic directions and Belgiums development cooperation priorities in the context of an evolving global health landscape,1,Neutral
healthcare_en,WHO and Switzerland cement cooperation until 2028,"WHO and Switzerland have announced the renewal of their cooperation strategy for the period 2024-2028. In 2013, Switzerland became the first high-income country in the WHO European Region to pilot a cooperation strategy with WHO (hereafter referred to as the WHO-Switzerland Cooperation Strategy). In 2022, WHO and Switzerland jointly decided to update and renew this cooperation strategy, which was done on 4 March 2025 at the Regional Office of the WHO in Copenhagen, Denmark.",WHO and Switzerland cement cooperation until 2028,WHO and Switzerland have announced the renewal of their cooperation strategy for the period 20242028 In 2013 Switzerland became the first highincome country in the WHO European Region to pilot a cooperation strategy with WHO hereafter referred to as the WHOSwitzerland Cooperation Strategy In 2022 WHO and Switzerland jointly decided to update and renew this cooperation strategy which was done on 4 March 2025 at the Regional Office of the WHO in Copenhagen Denmark,1,Positive
healthcare_en,Many pregnancy-related complications going undetected and untreated – WHO,"Haemorrhage – severe heavy bleeding – and hypertensive disorders like preeclampsia are the leading causes of maternal deaths globally, according to a new study released today by the World Health Organization (WHO). These conditions were responsible for around 80 000 and 50 000 fatalities respectively in 2020 – the last year for which published estimates are available - highlighting that many women still lack access to lifesaving treatments and effective care during and after pregnancy and birth.",Many pregnancyrelated complications going undetected and untreated WHO,Haemorrhage severe heavy bleeding and hypertensive disorders like preeclampsia are the leading causes of maternal deaths globally according to a new study released today by the World Health Organization WHO These conditions were responsible for around 80 000 and 50 000 fatalities respectively in 2020 the last year for which published estimates are available highlighting that many women still lack access to lifesaving treatments and effective care during and after pregnancy and birth,2,Positive
healthcare_en,WHO announces new collaborating centre on AI for health governance,"<p>The World Health Organization (WHO) today designated the Digital Ethics Centre at Delft University of Technology in the Netherlands as a WHO Collaborating Centre on artificial intelligence (AI) for health governance. &nbsp;</p><p>AI has the potential to re-shape health care, save lives and improve health and well-being. However, harnessing its benefits for good requires collaboration from stakeholders committed to robust governance, ethical safeguards, and evidence-based policies.&nbsp;</p><p><span style=""background-color: transparent; color: inherit; font-family: inherit; font-size: inherit; text-align: inherit; white-space: inherit;"">The WHO Collaborating Centre designation recognizes the Digital Ethics Centre at Delft University of Technology's decades-long history of cutting-edge research on responsible innovation, and its leadership in incorporating ethical values into design requirements for digital technologies. This inauguration marks the continuation of a strong partnership between the Digital Ethics Centre and WHO with the two entities jointly organizing international consultations, workshops, and the development of normative guidance and training in the past.&nbsp;&nbsp;</span></p><p>&ldquo;WHO is committed to helping Member States plan, govern, and adopt responsible AI technologies,&rdquo; said Dr Alain Labrique, Director of Digital Health and Innovation at WHO. &ldquo;We are witnessing remarkable progress, with AI poised to transform health systems and support individuals on their health journeys. To ensure these benefits reach everyone ethically, safely, and equitably, we rely on strong technical and academic partnerships that guide us in this rapidly evolving field.&rdquo;&nbsp;</p><p>The Collaborating Centre on AI for health governance will be instrumental in WHO&rsquo;s efforts to ensure the ethical and responsible use of AI for health by advancing research on priority topics and providing expert input for WHO&rsquo;s guidance development and policy-making. The Centre will serve as a hub for education and advocacy for science-driven research and facilitate knowledge-sharing and training through regional and country-level workshops.&nbsp;&nbsp;</p><p>&ldquo;The fruit of two decades of research in digital ethics and responsible innovation, the Delft Digital Ethics Centre is one of the frontrunners in operationalizing ethical values into design requirements for digital technologies such as artificial intelligence,"" Professor Jeroen van den Hoven, Scientific Director at Delft Digital Ethics Centre noted.<strong> ""</strong>We look forward to contributing to the global health community and advancing the responsible use of AI in health.""&nbsp;</p><p>The Responsible and Ethical AI for Healthcare Lab, a collaboration between Delft University of Technology and its partners, will provide valuable insight into the challenges involved in the successful implementation of WHO guidance in clinical practice.&nbsp;""The designation of the Digital Ethics Centre at Delft University of Technology as a WHO Collaborating Centre strengthens our collective ability to ensure AI serves public health equitably and responsibly. This collaboration will play a critical role in supporting Member States to navigate the opportunities and challenges of AI, fostering trust, transparency, and innovation in digital health,&rdquo; said Dr David Novillo-Ortiz, Regional Adviser and Unit Head for Data, Evidence and Digital Health at WHO&rsquo;s Regional Office for Europe.&nbsp;</p><p>The Collaborating Centre on AI for health emphasizes WHO&rsquo;s dedication to evidence-based AI governance, promoting its responsible use while upholding the highest ethical standards.&nbsp;</p><p></p>",WHO announces new collaborating centre on AI for health governance,The World Health Organization WHO today designated the Digital Ethics Centre at Delft University of Technology in the Netherlands as a WHO Collaborating Centre on artificial intelligence AI for health governance AI has the potential to reshape health care save lives and improve health and wellbeing However harnessing its benefits for good requires collaboration from stakeholders committed to robust governance ethical safeguards and evidencebased policies The WHO Collaborating Centre designation recognizes the Digital Ethics Centre at Delft University of Technologys decadeslong history of cuttingedge research on responsible innovation and its leadership in incorporating ethical values into design requirements for digital technologies This inauguration marks the continuation of a strong partnership between the Digital Ethics Centre and WHO with the two entities jointly organizing international consultations workshops and the development of normative guidance and training in the past WHO is committed to helping Member States plan govern and adopt responsible AI technologies said Dr Alain Labrique Director of Digital Health and Innovation at WHO We are witnessing remarkable progress with AI poised to transform health systems and support individuals on their health journeys To ensure these benefits reach everyone ethically safely and equitably we rely on strong technical and academic partnerships that guide us in this rapidly evolving field The Collaborating Centre on AI for health governance will be instrumental in WHOs efforts to ensure the ethical and responsible use of AI for health by advancing research on priority topics and providing expert input for WHOs guidance development and policymaking The Centre will serve as a hub for education and advocacy for sciencedriven research and facilitate knowledgesharing and training through regional and countrylevel workshops The fruit of two decades of research in digital ethics and responsible innovation the Delft Digital Ethics Centre is one of the frontrunners in operationalizing ethical values into design requirements for digital technologies such as artificial intelligence Professor Jeroen van den Hoven Scientific Director at Delft Digital Ethics Centre noted We look forward to contributing to the global health community and advancing the responsible use of AI in health The Responsible and Ethical AI for Healthcare Lab a collaboration between Delft University of Technology and its partners will provide valuable insight into the challenges involved in the successful implementation of WHO guidance in clinical practice The designation of the Digital Ethics Centre at Delft University of Technology as a WHO Collaborating Centre strengthens our collective ability to ensure AI serves public health equitably and responsibly This collaboration will play a critical role in supporting Member States to navigate the opportunities and challenges of AI fostering trust transparency and innovation in digital health said Dr David NovilloOrtiz Regional Adviser and Unit Head for Data Evidence and Digital Health at WHOs Regional Office for Europe The Collaborating Centre on AI for health emphasizes WHOs dedication to evidencebased AI governance promoting its responsible use while upholding the highest ethical standards,0,Positive
healthcare_en,WHO and the Kingdom of Saudi Arabia sign agreements in support of health priorities,"The Riyadh International Humanitarian Forum 2025 was a significant event that underscored the continued partnership between WHO and KSrelief, as well as with other international partners to address critical humanitarian health crises. The agreements made during the forum are pivotal in combating diseases like malaria, cholera, and polio, and ensuring better healthcare for displaced populations. The forum also highlighted Saudi Arabia’s ongoing commitment to global humanitarian efforts, reaffirming its leadership role in tackling some of the world’s pressing health crises.",WHO and the Kingdom of Saudi Arabia sign agreements in support of health priorities,The Riyadh International Humanitarian Forum 2025 was a significant event that underscored the continued partnership between WHO and KSrelief as well as with other international partners to address critical humanitarian health crises The agreements made during the forum are pivotal in combating diseases like malaria cholera and polio and ensuring better healthcare for displaced populations The forum also highlighted Saudi Arabias ongoing commitment to global humanitarian efforts reaffirming its leadership role in tackling some of the worlds pressing health crises,1,Positive
education_en,Education secretary orders inquiry into allegations of student loan fraud,"<p>Bridget Phillipson instructs Public Sector Fraud Authority to look into whether millions of pounds falsely claimed</p><p>Fraud experts will investigate the university loans system amid concerns that students are falsely claiming millions of pounds without intending to study, the education secretary has announced.</p><p>Bridget Phillipson has instructed the Public Sector Fraud Authority to coordinate the response to allegations that individuals with no genuine academic intent are enrolling in degree courses to secure loans.</p> <a href=""https://www.theguardian.com/education/2025/mar/23/education-secretary-orders-inquiry-into-allegations-of-student-loan"">Continue reading...</a>",Education secretary orders inquiry into allegations of student loan fraud,Bridget Phillipson instructs Public Sector Fraud Authority to look into whether millions of pounds falsely claimedFraud experts will investigate the university loans system amid concerns that students are falsely claiming millions of pounds without intending to study the education secretary has announcedBridget Phillipson has instructed the Public Sector Fraud Authority to coordinate the response to allegations that individuals with no genuine academic intent are enrolling in degree courses to secure loans Continue reading,1,Positive
education_en,Elton John backs Ed Sheeran’s call for UK to put £250m into music education,"<p>Coldplay, Harry Styles and Stormzy also join Suffolk songwriter in campaigning for music funding in schools</p><p>Elton John, Coldplay, Harry Styles, Stormzy and Central Cee are among the artists backing a call from Ed Sheeran for Keir Starmer to commit £250m of funding for music education.</p><p>As part of his newly launched Ed Sheeran Foundation, the Suffolk songwriter is campaigning for music funding in schools, training for music teachers, funding for grassroots venues and spaces, apprenticeships in music and a more diverse music curriculum.</p> <a href=""https://www.theguardian.com/music/2025/mar/23/elton-john-backs-ed-sheerans-call-for-uk-to-put-250m-into-music-education"">Continue reading...</a>",Elton John backs Ed Sheerans call for UK to put 250m into music education,Coldplay Harry Styles and Stormzy also join Suffolk songwriter in campaigning for music funding in schoolsElton John Coldplay Harry Styles Stormzy and Central Cee are among the artists backing a call from Ed Sheeran for Keir Starmer to commit 250m of funding for music educationAs part of his newly launched Ed Sheeran Foundation the Suffolk songwriter is campaigning for music funding in schools training for music teachers funding for grassroots venues and spaces apprenticeships in music and a more diverse music curriculum Continue reading,0,Positive
